{
  "$schema": "../schemas/review-thread-reconciliation.schema.json",
  "identity": {
    "uuidV5": "639e8139-1107-51f4-9949-333119ddb0be",
    "uuidV7": "01a04a0b-578f-7ab8-8be3-9ea9f2d7a6c6",
    "namespace": "47f3e535-0e27-559a-9556-aa79a84f95eb"
  },
  "temporal": {
    "observedAt": "2026-08-28T20:24:12.431Z",
    "epochMs": 1787948652431,
    "timeZone": "UTC"
  },
  "status": "VERIFIED",
  "scope": {
    "repository": "Anionix/verifiable-offline-webmcp-agent-spec",
    "inspectedClosedPullRequests": 50,
    "currentPullRequest": 51,
    "newExternalReviewActivityAfterFinalMerge": 18,
    "actualNotifications": 0,
    "notificationPermissionRequests": 0,
    "externalEffects": 0
  },
  "findings": [
    {
      "informationUuidV5": "8eaae828-350e-5d0c-9230-ab7239c6ff9c",
      "sourcePullRequest": 23,
      "reviewUrl": "https://github.com/Anionix/verifiable-offline-webmcp-agent-spec/pull/23#discussion_r3881069522",
      "severity": "P1",
      "title": "実通知の全監査イベントを対象Intentへ結び付ける",
      "disposition": "FIXED_IN_PATCH",
      "fixEvidence": ["scripts/validate_repo.py"],
      "testEvidence": ["scripts/validate_repo.py#live-notification-mutation-probe"]
    },
    {
      "informationUuidV5": "582c16cc-3508-50fb-8d03-fda185f0cc31",
      "sourcePullRequest": 25,
      "reviewUrl": "https://github.com/Anionix/verifiable-offline-webmcp-agent-spec/pull/25#discussion_r3881453910",
      "severity": "P1",
      "title": "追跡外のImpeccableキャッシュを整合性生成物から除外する",
      "disposition": "FIXED_BEFORE_PATCH",
      "fixEvidence": ["scripts/build_manifest.py"],
      "testEvidence": ["scripts/build_manifest.py#EXCLUDED_PATHS"]
    },
    {
      "informationUuidV5": "1a0d3251-9d1e-5cf5-b7c1-3730c225a55e",
      "sourcePullRequest": 25,
      "reviewUrl": "https://github.com/Anionix/verifiable-offline-webmcp-agent-spec/pull/25#discussion_r3881453919",
      "severity": "P2",
      "title": "再表示時に永続Intent状態と実測効果数を復元する",
      "disposition": "FIXED_IN_PATCH",
      "fixEvidence": ["examples/notification-demo/app.js", "examples/notification-demo/visual-state.js"],
      "testEvidence": ["src/typescript/test/notification-visualization.test.js"]
    },
    {
      "informationUuidV5": "8794ae83-d0d5-553a-a48c-0ca34cddc860",
      "sourcePullRequest": 29,
      "reviewUrl": "https://github.com/Anionix/verifiable-offline-webmcp-agent-spec/pull/29#discussion_r3881745433",
      "severity": "P2",
      "title": "入力投影とEngineでUnicode文字数の単位を一致させる",
      "disposition": "FIXED_IN_PATCH",
      "fixEvidence": ["src/typescript/notification/engine.ts"],
      "testEvidence": ["src/typescript/test/notification.test.ts#astral-Unicode"]
    },
    {
      "informationUuidV5": "d0cbd2d7-4641-5341-8ecd-6c3ec70ecb50",
      "sourcePullRequest": 31,
      "reviewUrl": "https://github.com/Anionix/verifiable-offline-webmcp-agent-spec/pull/31#discussion_r3882005648",
      "severity": "P1",
      "title": "追跡外のPlaywright生成物を整合性生成物から除外する",
      "disposition": "FIXED_BEFORE_PATCH",
      "fixEvidence": ["scripts/build_manifest.py"],
      "testEvidence": ["scripts/build_manifest.py#EXCLUDED_PARTS"]
    },
    {
      "informationUuidV5": "5eb768bd-d625-54bd-ac1e-7344f214c629",
      "sourcePullRequest": 36,
      "reviewUrl": "https://github.com/Anionix/verifiable-offline-webmcp-agent-spec/pull/36#discussion_r3882287954",
      "severity": "P1",
      "title": "取込操作を署名済み元イベントへ結び付ける",
      "disposition": "FIXED_IN_PATCH",
      "fixEvidence": ["src/typescript/sync/device-log.ts", "src/typescript/sync/synchronizer.ts", "scripts/validate_repo.py"],
      "testEvidence": ["src/typescript/test/offline-sync.test.ts#signed-source-binding"]
    },
    {
      "informationUuidV5": "7de0ffb0-07d0-57d5-ab26-18a0fc3bb5fa",
      "sourcePullRequest": 41,
      "reviewUrl": "https://github.com/Anionix/verifiable-offline-webmcp-agent-spec/pull/41#discussion_r3882524151",
      "severity": "P2",
      "title": "不正なfunction_callを捨てず応答全体を停止する",
      "disposition": "FIXED_IN_PATCH",
      "fixEvidence": ["src/typescript/planner/responses-adapter.ts"],
      "testEvidence": ["src/typescript/test/online-planner.test.ts#malformed-function-call"]
    },
    {
      "informationUuidV5": "50c742e0-9680-5e81-aba8-10d16e668220",
      "sourcePullRequest": 41,
      "reviewUrl": "https://github.com/Anionix/verifiable-offline-webmcp-agent-spec/pull/41#discussion_r3882524159",
      "severity": "P2",
      "title": "直列化済みPlanner入力の4096文字上限を守る",
      "disposition": "FIXED_IN_PATCH",
      "fixEvidence": ["src/typescript/planner/policy.ts"],
      "testEvidence": ["src/typescript/test/online-planner.test.ts#serialized-input-limit"]
    },
    {
      "informationUuidV5": "bb100684-f2fc-50a3-ad9b-4be3516a9a10",
      "sourcePullRequest": 41,
      "reviewUrl": "https://github.com/Anionix/verifiable-offline-webmcp-agent-spec/pull/41#discussion_r3882524168",
      "severity": "P2",
      "title": "入れ子の道具引数Schemaを再帰的に閉じる",
      "disposition": "FIXED_IN_PATCH",
      "fixEvidence": ["schemas/responses-planner-request.schema.json"],
      "testEvidence": ["scripts/validate_repo.py#nested-parameter-schema-mutation"]
    },
    {
      "informationUuidV5": "22dd0cf8-3860-58c7-a151-18ac5cc50ac4",
      "sourcePullRequest": 46,
      "reviewUrl": "https://github.com/Anionix/verifiable-offline-webmcp-agent-spec/pull/46#discussion_r3882696229",
      "severity": "P1",
      "title": "契約レジストリのキーと道具識別子を一致させる",
      "disposition": "FIXED_IN_PATCH",
      "fixEvidence": ["src/typescript/governance/security-boundary.ts"],
      "testEvidence": ["src/typescript/test/security-boundary.test.ts#registry-identity"]
    },
    {
      "informationUuidV5": "2f782c09-ee7e-525f-8468-9c7c8f3e0d6d",
      "sourcePullRequest": 46,
      "reviewUrl": "https://github.com/Anionix/verifiable-offline-webmcp-agent-spec/pull/46#discussion_r3882696235",
      "severity": "P1",
      "title": "項目名に依存せず秘密らしい値を拒否する",
      "disposition": "FIXED_IN_PATCH",
      "fixEvidence": ["src/typescript/governance/security-boundary.ts"],
      "testEvidence": ["src/typescript/test/security-boundary.test.ts#secret-shaped-values"]
    },
    {
      "informationUuidV5": "a815615d-759f-5bd1-a9c5-6a60ef788058",
      "sourcePullRequest": 46,
      "reviewUrl": "https://github.com/Anionix/verifiable-offline-webmcp-agent-spec/pull/46#discussion_r3882696241",
      "severity": "P1",
      "title": "権限判断前に評価時刻を安全な整数として検査する",
      "disposition": "FIXED_IN_PATCH",
      "fixEvidence": ["src/typescript/governance/security-boundary.ts"],
      "testEvidence": ["src/typescript/test/security-boundary.test.ts#invalid-clock"]
    },
    {
      "informationUuidV5": "a78e5edb-4249-5009-a310-cc0131da6759",
      "sourcePullRequest": 46,
      "reviewUrl": "https://github.com/Anionix/verifiable-offline-webmcp-agent-spec/pull/46#discussion_r3882696250",
      "severity": "P2",
      "title": "変更契約に空でない読取対象と書込対象を要求する",
      "disposition": "FIXED_IN_PATCH",
      "fixEvidence": ["src/typescript/governance/security-boundary.ts"],
      "testEvidence": ["src/typescript/test/security-boundary.test.ts#mutation-read-write-sets"]
    },
    {
      "informationUuidV5": "f3a07aea-ce60-5dff-9b0d-7140f057fe76",
      "sourcePullRequest": 47,
      "reviewUrl": "https://github.com/Anionix/verifiable-offline-webmcp-agent-spec/pull/47#discussion_r3883049431",
      "severity": "P1",
      "title": "鮮度境界と同じミリ秒の証拠を古いものとして拒否する",
      "disposition": "FIXED_IN_PATCH",
      "fixEvidence": ["src/typescript/governance/replay-verification.ts"],
      "testEvidence": ["src/typescript/test/replay-verification.test.ts#freshness-boundary"]
    },
    {
      "informationUuidV5": "4d52b526-114b-5826-8d53-ab6e4dadc476",
      "sourcePullRequest": 51,
      "reviewUrl": "https://github.com/Anionix/verifiable-offline-webmcp-agent-spec/pull/51#discussion_r3883895232",
      "severity": "P2",
      "title": "旧同期台帳を署名済み元イベントの再取込で修復可能にする",
      "disposition": "FIXED_IN_PATCH",
      "fixEvidence": ["src/typescript/sync/synchronizer.ts"],
      "testEvidence": ["src/typescript/test/offline-sync.test.ts#legacy-source-migration"]
    },
    {
      "informationUuidV5": "0a6e95b1-f829-5429-9caa-bd142f018915",
      "sourcePullRequest": 51,
      "reviewUrl": "https://github.com/Anionix/verifiable-offline-webmcp-agent-spec/pull/51#discussion_r3883895237",
      "severity": "P2",
      "title": "別処理が先に進めた最新の永続状態を受け入れる",
      "disposition": "FIXED_IN_PATCH",
      "fixEvidence": ["examples/notification-demo/app.js", "examples/notification-demo/visual-state.js"],
      "testEvidence": ["src/typescript/test/notification-visualization.test.js#newer-status-readback"]
    },
    {
      "informationUuidV5": "bcad8087-6a22-59b1-99f9-cb3ce9179242",
      "sourcePullRequest": 51,
      "reviewUrl": "https://github.com/Anionix/verifiable-offline-webmcp-agent-spec/pull/51#discussion_r3883895242",
      "severity": "P2",
      "title": "入れ子Schemaの宣言項目と必須項目を完全一致させる",
      "disposition": "FIXED_IN_PATCH",
      "fixEvidence": ["scripts/validate_repo.py"],
      "testEvidence": ["scripts/validate_repo.py#strict-parameter-contract-errors"]
    },
    {
      "informationUuidV5": "a49f40c5-65fa-5363-b64f-be5d86766914",
      "sourcePullRequest": 51,
      "reviewUrl": "https://github.com/Anionix/verifiable-offline-webmcp-agent-spec/pull/51#discussion_r3883919859",
      "severity": "P2",
      "title": "WebMCPの再表示でも永続済みIntent状態を復元する",
      "disposition": "FIXED_IN_PATCH",
      "fixEvidence": ["examples/notification-demo/app.js", "src/typescript/webmcp/notification-adapter.js"],
      "testEvidence": ["src/typescript/test/webmcp-notification-adapter.test.js#persisted-intent-restoration"]
    },
    {
      "informationUuidV5": "634d296a-aa05-536e-9874-70c499eee377",
      "sourcePullRequest": 51,
      "reviewUrl": "https://github.com/Anionix/verifiable-offline-webmcp-agent-spec/pull/51#discussion_r3883919868",
      "severity": "P2",
      "title": "厳格Schemaの最小値と最大値の逆転を拒否する",